[
  {
    "id": "PIL-CORE-001",
    "name": "Toe Taps (Marching)",
    "muscleGroup": "core",
    "difficulty": 1,
    "difficultyLabel": "Beginner",
    "equipment": [
      "none"
    ],
    "duration": 60,
    "instructions": "Lie supine on the floor or mat with arms at your sides and legs bent in tabletop position (hips and knees at 90 degrees). Inhale to prepare. Exhale as you slowly lower one foot toward the floor, hinging solely from the hip joint while maintaining a steady 90-degree knee bend. Lightly tap your toe to the floor, then inhale to return to tabletop. Alternate sides with steady abdominal control. Keep pelvis anchored in neutral; hinge only from the hip joint.",
    "category": "Anterior Core & Abdominals",
    "targetMuscles": [
      "Transverse Abdominis",
      "Rectus Abdominis"
    ],
    "focus": "core",
    "reps": "10-12 reps per side",
    "keyCue": "Keep pelvis anchored in neutral; hinge only from the hip joint."
  },
  {
    "id": "PIL-CORE-002",
    "name": "The Hundred (Knees Bent)",
    "muscleGroup": "core",
    "difficulty": 1,
    "difficultyLabel": "Beginner",
    "equipment": [
      "none"
    ],
    "duration": 60,
    "instructions": "Lie supine on the floor or mat. Lift knees into tabletop or extend long at 45 degrees. Curl head, neck, and shoulders off the surface into thoracic flexion, reaching arms forward vigorously at hip height. Inhale for 5 rhythmic arm pumps, exhale for 5 rhythmic arm pumps. Complete 10 full breath cycles (100 pumps total). Keep your lower back anchored and abdomen drawn deeply toward the spine.",
    "category": "Anterior Core & Abdominals",
    "targetMuscles": [
      "Transverse Abdominis",
      "Anterior Core"
    ],
    "focus": "core",
    "reps": "10 breath cycles (100 pumps)",
    "keyCue": "Pump arms briskly from the shoulder joint while maintaining a C-curve."
  },
  {
    "id": "PIL-CORE-003",
    "name": "Single Leg Stretch",
    "muscleGroup": "core",
    "difficulty": 1,
    "difficultyLabel": "Beginner",
    "equipment": [
      "none"
    ],
    "duration": 50,
    "instructions": "Lie supine with head and shoulders curled into an abdominal curl. Draw one knee into your chest, placing outside hand on the ankle and inside hand on the knee. Extend the opposite leg straight out at a 45-degree angle. Inhale to prepare, exhale as you switch legs with control and rhythm. Maintain pelvis stability and keep shoulders relaxed away from the ears.",
    "category": "Anterior Core & Abdominals",
    "targetMuscles": [
      "Rectus Abdominis",
      "Hip Flexors"
    ],
    "focus": "core",
    "reps": "10 reps per side",
    "keyCue": "Press hand to shin to maintain isometric resistance."
  },
  {
    "id": "PIL-CORE-004",
    "name": "The Roll Up",
    "muscleGroup": "core",
    "difficulty": 2,
    "difficultyLabel": "Intermediate",
    "equipment": [
      "mat"
    ],
    "duration": 70,
    "instructions": "Lie supine on the mat with legs extended straight and glued together, feet flexed. Reach arms straight toward the ceiling, then overhead without flaring ribs. Inhale as arms lift past vertical and head nods forward. Exhale as you peel the spine off the mat bone by bone, reaching forward over toes in a deep C-curve while scooping the abdomen backward. Inhale to begin articulating down; exhale to return supine.",
    "category": "Anterior Core & Abdominals",
    "targetMuscles": [
      "Rectus Abdominis",
      "Transverse Abdominis"
    ],
    "focus": "core",
    "reps": "5-6 slow reps",
    "keyCue": "Peel the spine off the mat bone by bone; avoid using momentum."
  },
  {
    "id": "PIL-CORE-005",
    "name": "Double Leg Stretch",
    "muscleGroup": "core",
    "difficulty": 2,
    "difficultyLabel": "Intermediate",
    "equipment": [
      "mat"
    ],
    "duration": 60,
    "instructions": "Lie supine curled into a tight abdominal ball with knees hugging toward chest and hands resting on shins. Inhale as you simultaneously reach both arms overhead by ears and extend both legs long at a 45-degree angle, keeping the low back anchored to the mat. Exhale as you sweep arms around in a wide circle and draw knees back into chest, pulling abdominals deeper.",
    "category": "Anterior Core & Abdominals",
    "targetMuscles": [
      "Rectus Abdominis",
      "Transverse Abdominis",
      "Hip Flexors"
    ],
    "focus": "core",
    "reps": "8-10 reps",
    "keyCue": "Keep the lumbar spine firmly anchored as limbs reach in opposition."
  },
  {
    "id": "PIL-CORE-007",
    "name": "The Teaser (Full Mat)",
    "muscleGroup": "core",
    "difficulty": 3,
    "difficultyLabel": "Advanced",
    "equipment": [
      "mat"
    ],
    "duration": 75,
    "instructions": "Lie supine with arms reaching overhead and legs extended together at a 45-degree angle. Inhale to lift arms toward the ceiling and nod head. Exhale as you roll your entire torso off the mat into a balanced V-sit on your sit bones, reaching arms parallel to extended legs. Hold with chest proud. Inhale, then exhale as you roll down vertebra by vertebra with control.",
    "category": "Anterior Core & Abdominals",
    "targetMuscles": [
      "Rectus Abdominis",
      "Iliopsoas",
      "Transverse Abdominis"
    ],
    "focus": "core",
    "reps": "4-5 reps",
    "keyCue": "Lift chest open at the peak of the V-position; roll down with control."
  },
  {
    "id": "PIL-CORE-009",
    "name": "Jackknife",
    "muscleGroup": "core",
    "difficulty": 3,
    "difficultyLabel": "Advanced",
    "equipment": [
      "mat"
    ],
    "duration": 60,
    "instructions": "Lie supine with arms pressed firmly into the mat. Inhale as straight legs lift to vertical and roll over torso parallel to the mat. Exhale as you Jackknife legs straight up toward the ceiling, balancing on shoulder girdle and triceps with hips fully extended. Inhale at the vertical peak. Exhale as you articulate the spine slowly down to the mat, vertebra by vertebra.",
    "category": "Anterior Core & Abdominals",
    "targetMuscles": [
      "Rectus Abdominis",
      "Transverse Abdominis",
      "Triceps"
    ],
    "focus": "core",
    "reps": "3-4 reps",
    "keyCue": "Shoot legs straight toward the ceiling; articulate down one vertebra at a time."
  },
  {
    "id": "PIL-OBL-001",
    "name": "Side Kick Series: Up/Down",
    "muscleGroup": "obliques",
    "difficulty": 1,
    "difficultyLabel": "Beginner",
    "equipment": [
      "mat"
    ],
    "duration": 60,
    "instructions": "Lie on your side along the back edge of the mat, propped on forearm or head resting on bottom arm. Angle straight legs forward 30 degrees to front mat corner to support lumbar spine. Inhale as you kick top leg straight up toward ceiling with pointed toe and external rotation. Exhale as you flex foot and resist down through resistance, keeping waistline lifted off the mat.",
    "category": "Obliques & Lateral Chain",
    "targetMuscles": [
      "Gluteus Medius",
      "External Obliques",
      "Tensor Fasciae Latae"
    ],
    "focus": "core",
    "reps": "10 reps per side",
    "keyCue": "Keep the underside waist lifted away from the mat throughout the kick."
  },
  {
    "id": "PIL-OBL-002",
    "name": "Criss-Cross",
    "muscleGroup": "obliques",
    "difficulty": 2,
    "difficultyLabel": "Intermediate",
    "equipment": [
      "none"
    ],
    "duration": 60,
    "instructions": "Lie supine in tabletop position with hands clasped lightly behind the base of the head, elbows wide. Curl head and chest up. Exhale to rotate your ribcage, bringing your right armpit toward your left knee as your right leg extends long at 45 degrees. Inhale back through center, then exhale and rotate to the opposite side. Avoid pulling on the neck; rotate strictly from the thoracic spine and obliques.",
    "category": "Obliques & Lateral Chain",
    "targetMuscles": [
      "External Obliques",
      "Internal Obliques",
      "Transverse Abdominis"
    ],
    "focus": "core",
    "reps": "10 slow reps per side",
    "keyCue": "Lift armpit across toward opposite knee; keep both sit bones anchored."
  },
  {
    "id": "PIL-OBL-003",
    "name": "Side Plank (Knees Down)",
    "muscleGroup": "obliques",
    "difficulty": 2,
    "difficultyLabel": "Intermediate",
    "equipment": [
      "none"
    ],
    "duration": 50,
    "instructions": "Lie on your side with hips stacked, knees bent at 90 degrees, and bottom forearm resting firmly on the floor under your shoulder. Inhale to engage your lats and core. Exhale to lift hips up until your body forms a diagonal line from knees to head. Hold steady while maintaining an engaged lateral chain and proud chest. Inhale and lower with control.",
    "category": "Obliques & Lateral Chain",
    "targetMuscles": [
      "Internal Obliques",
      "External Obliques",
      "Quadratus Lumborum"
    ],
    "focus": "core",
    "reps": "30-40s hold per side",
    "keyCue": "Lift out of bottom shoulder; maintain straight diagonal line from knees to head."
  },
  {
    "id": "PIL-OBL-005",
    "name": "Corkscrew",
    "muscleGroup": "obliques",
    "difficulty": 3,
    "difficultyLabel": "Advanced",
    "equipment": [
      "mat"
    ],
    "duration": 60,
    "instructions": "Lie supine, arms pressed long by your sides. Lift straight legs up to 90 degrees, then roll over so legs are parallel to mat over head. Shift legs slightly to the right, roll down along the right side of the spine, circle legs down and around across center, then roll up the left side of the spine back into rollover. Reverse direction on subsequent rep with smooth control.",
    "category": "Obliques & Lateral Chain",
    "targetMuscles": [
      "Obliques",
      "Transverse Abdominis",
      "Erector Spinae"
    ],
    "focus": "core",
    "reps": "3-4 circles per direction",
    "keyCue": "Circle legs around pelvis while keeping shoulders glued to the mat."
  },
  {
    "id": "PIL-OBL-006",
    "name": "Side Bend (Mermaid into Plank)",